{
  "protocol_version": 2,
  "station_id": "st-charlottendal",
  "revision": {
    "config_version": 12,
    "movements": {
      "movement-421-cda": 4
    },
    "cases": {
      "clr-88f2": 2
    }
  },
  "movements": [
    {
      "id": "movement-421-cda",
      "train_number": "421",
      "arrival_time": null,
      "departure_time": "09:20",
      "departure": "positioned",
      "arrival": "none",
      "assignedTrackId": "track-charlottendal-c-1",
      "actualTrack": null,
      "crewReady": true
    }
  ],
  "active_clearances": [
    {
      "clearance_id": "clr-88f2",
      "movement_id": "movement-421-cda",
      "connection_id": "connection-cda-vst",
      "status": "waiting",
      "from_station_id": "st-charlottendal",
      "to_station_id": "st-vst"
    }
  ],
  "line_messages": [],
  "clock": {
    "time": "09:23",
    "running": true,
    "stopped_reason": null
  }
}
